ID;customerName;productName;titleCustomerLanguage;customerId;productId;originatingCountry;sourceLanguage;fullMessageCustomerLanguage
f3c7560a-f5f8-49f6-a824-2517548c0cf0;John Doe;Laptop;Demande de renseignements sur le produit;f3c7560a-f5f8-49f6-a824-2517548c0cf0;ba3c3b54-677e-47b8-b66f-a8a185f65671;France;French;Je souhaite obtenir des informations détaillées sur les spécifications techniques et les performances du laptop que vous vendez. Pouvez-vous me fournir ces détails?
ba3c3b54-677e-47b8-b66f-a8a185f65671;Jane Smith;Smartphone;Produit défectueux;ba3c3b54-677e-47b8-b66f-a8a185f65671;35b7f78b-d9b4-4713-91c1-716d935fed8f;France;French;J'ai reçu le smartphone commandé et la qualité de l'écran est médiocre. Il ne répond pas correctement et affiche des lignes colorées. Comment puis-je obtenir un remplacement ou un remboursement?
35b7f78b-d9b4-4713-91c1-716d935fed8f;Sarah Johnson;Headphones;Retard de livraison;35b7f78b-d9b4-4713-91c1-716d935fed8f;ec41a6d3-2297-4610-a586-dffbd73d91b6;France;French;J'ai commandé des écouteurs il y a deux semaines et je ne les ai toujours pas reçus. Le suivi indique qu'ils sont en transit mais il n'y a pas eu de mise à jour depuis plusieurs jours. Pouvez-vous vérifier l'état de ma livraison?
ec41a6d3-2297-4610-a586-dffbd73d91b6;Michael Brown;Camera;Pièces manquantes;ec41a6d3-2297-4610-a586-dffbd73d91b6;b9201484-2d80-42ab-8c5d-cf63ab367f3a;France;French;La caméra que j'ai commandée est incomplète, il manque des pièces essentielles comme le chargeur et le câble de connexion. Comment puis-je recevoir les pièces manquantes ou obtenir un remplacement?
b9201484-2d80-42ab-8c5d-cf63ab367f3a;Emily Wilson;Tablet;Retour de produit;b9201484-2d80-42ab-8c5d-cf63ab367f3a;f27aa0f7-794e-4926-8e55-4ed61d313f2f;France;French;J'ai acheté une tablette qui ne répond pas à mes attentes. Je souhaite la retourner et obtenir un remboursement. Quelle est la procédure pour effectuer le retour et recevoir le remboursement?